Time,Event,Link
04/05/2023 10:13,AGR: Nghị quyết và Biên bản họp ĐHĐCĐ thường niên năm 2023,/du-lieu/agr-241226/agr-nghi-quyet-va-bien-ban-hop-dhdcd-thuong-nien-nam-2023.chn
10/03/2023 17:19,"AGR: 4.4.2023, giao dịch 3.391.309 cp niêm yết bổ sung",/du-lieu/agr-308447/agr-442023-giao-dich-3391309-cp-niem-yet-bo-sung.chn
07/03/2023 13:37,"AGR: 8.3.2023, niêm yết bổ sung 3.391.309 cp",/du-lieu/agr-311639/agr-832023-niem-yet-bo-sung-3391309-cp.chn
12/01/2023 17:51,AGR: Số lượng cổ phiếu có quyền biểu quyết đang lưu hành là 215.391.262 cp,/du-lieu/agr-339113/agr-so-luong-co-phieu-co-quyen-bieu-quyet-dang-luu-hanh-la-215391262-cp.chn
12/01/2023 17:49,AGR: Đã phát hành 3.391.309 cp để tăng vốn cổ phần từ nguồn vốn chủ sở hữu,/du-lieu/agr-339122/agr-da-phat-hanh-3391309-cp-de-tang-von-co-phan-tu-nguon-von-chu-so-huu.chn
20/12/2022 10:56,"AGR: 28.12.2022, ngày GDKHQ thưởng cp (tỷ lệ 100.000 : 1.602)",/du-lieu/agr-349889/agr-28122022-ngay-gdkhq-thuong-cp-ty-le-100000--1602.chn
15/12/2022 09:50,AGR: Phát hành cổ phiếu để tăng vốn cổ phần từ NVCSH,/du-lieu/agr-351842/agr-phat-hanh-co-phieu-de-tang-von-co-phan-tu-nvcsh.chn
29/06/2022 17:04,AGR: Nghị quyết và Biên bản họp ĐHĐCĐ thường niên năm 2022,/du-lieu/agr-439559/agr-nghi-quyet-va-bien-ban-hop-dhdcd-thuong-nien-nam-2022.chn
18/08/2021 18:06,AGR: Số lượng cổ phiếu có quyền biểu quyết đang lưu hành là 211.999.953,/du-lieu/agr-1554709/agr-so-luong-co-phieu-co-quyen-bieu-quyet-dang-luu-hanh-la-211999953.chn
18/08/2021 11:21,AGR: Đã bán 800.000 cổ phiếu quỹ,/du-lieu/agr-1531507/agr-da-ban-800000-co-phieu-quy.chn
14/07/2021 13:45,AGR: Đăng ký bán 800.000 cp quỹ,/du-lieu/agr-1578406/agr-dang-ky-ban-800000-cp-quy.chn
01/07/2021 15:29,"Chứng khoán Agribank (AGR) ước lãi 6 tháng đầu năm 160 tỷ đồng, quyết tâm xóa lỗ lũy kế trong năm 2021",/du-lieu/agr-1313953/chung-khoan-agribank-agr-uoc-lai-6-thang-dau-nam-160-ty-dong-quyet-tam-xoa-lo-luy-ke-trong-nam-2021.chn
21/08/2017 08:58,AGR: Quyết định chuyển cổ phiếu từ diện kiểm soát sang diện cảnh báo,/du-lieu/agr-1081327/agr-quyet-dinh-chuyen-co-phieu-tu-dien-kiem-soat-sang-dien-canh-bao.chn
07/07/2017 10:38,AGR: Đã bán 10.000 cp quỹ,/du-lieu/agr-1103047/agr-da-ban-10000-cp-quy.chn
30/03/2017 00:00,AGR: Số lượng cổ phiếu có quyền biểu quyết đang lưu hành là 211.189.953 cp,/du-lieu/agr-1144336/agr-so-luong-co-phieu-co-quyen-bieu-quyet-dang-luu-hanh-la-211189953-cp.chn
04/01/2012 14:52,BHT: AGR được lợi lớn từ chuyển đổi trái phiếu?,/du-lieu/agr-755292/bht-agr-duoc-loi-lon-tu-chuyen-doi-trai-phieu.chn
11/01/2011 17:43,AGF: đã mua 80.000 cổ phiếu quỹ,/du-lieu/agr-740860/agf-da-mua-80000-co-phieu-quy.chn
29/10/2010 15:41,AGR: Đăng ký mua lại 3 triệu CP quỹ,/du-lieu/agr-658262/agr-dang-ky-mua-lai-3-trieu-cp-quy.chn
20/10/2010 16:50,AGR: Nghị quyết HĐQT thông qua việc mua lại 3 triệu CP Quỹ,/du-lieu/agr-591422/agr-nghi-quyet-hdqt-thong-qua-viec-mua-lai-3-trieu-cp-quy.chn
10/09/2010 17:27,AGR: 17/9 Giao dịch bổ sung 92.000.000 CP,/du-lieu/agr-669858/agr-179-giao-dich-bo-sung-92000000-cp.chn
10/09/2010 17:06,AGR: Chấp thuận niêm yết bổ sung 92.000.000 CP,/du-lieu/agr-655700/agr-chap-thuan-niem-yet-bo-sung-92000000-cp.chn
23/08/2010 17:00,AGR: Điều chỉnh vốn điều lệ thành 2.120 tỷ đồng,/du-lieu/agr-621845/agr-dieu-chinh-von-dieu-le-thanh-2120-ty-dong.chn
13/08/2010 17:27,AGR: Thông qua niêm yết bổ sung CP trả cổ tức 10%,/du-lieu/agr-744208/agr-thong-qua-niem-yet-bo-sung-cp-tra-co-tuc-10.chn
06/07/2010 11:05,AGR: 13/7 NGDKHQ cho việc lấy ý kiến cổ đông bằng văn bản về việc niêm yết cổ phiếu trả cổ tức,/du-lieu/agr-664908/agr-137-ngdkhq-cho-viec-lay-y-kien-co-dong-bang-van-ban-ve-viec-niem-yet-co-phieu-tra-co-tuc.chn
10/06/2010 16:03,AGR: 17/6 GDKHQ nhận cổ tức bằng cổ phiếu tỷ lệ 10%,/du-lieu/agr-643644/agr-176-gdkhq-nhan-co-tuc-bang-co-phieu-ty-le-10.chn
26/04/2010 16:14,AGR: Thay đổi tài khoản phong tỏa phát hành cổ phiếu Agriseco,/du-lieu/agr-740692/agr-thay-doi-tai-khoan-phong-toa-phat-hanh-co-phieu-agriseco.chn
05/01/2010 17:56,AGR: Nghị quyết ĐHCĐ thông qua phương án tăng vốn điều lệ lên 2.000 tỷ đồng,/du-lieu/agr-627359/agr-nghi-quyet-dhcd-thong-qua-phuong-an-tang-von-dieu-le-len-2000-ty-dong.chn
23/12/2009 15:23,AGR: Xin ý kiến cổ đông chào bán cổ phiếu tỷ lệ 3:2 bằng mệnh giá,/du-lieu/agr-641276/agr-xin-y-kien-co-dong-chao-ban-co-phieu-ty-le-32-bang-menh-gia.chn
09/12/2009 17:30,AGR: 23/11/2009 - Ngày ĐKCC chốt danh sách niêm yết trên Hose và lấy ý kiến phát hành thêm CP,/du-lieu/agr-643858/agr-23112009-ngay-dkcc-chot-danh-sach-niem-yet-tren-hose-va-lay-y-kien-phat-hanh-them-cp.chn
09/12/2009 17:27,AGR: Niêm yết 120 triệu cổ phiếu lên Hose,/du-lieu/agr-643902/agr-niem-yet-120-trieu-co-phieu-len-hose.chn
